{
  "fsm_version": "1.0.0",
  "description": "Spec-driven multi-agent software delivery FSM for Store OS.",
  "concurrency": {
    "max_parallel_editors": 4,
    "review_quorum": 2,
    "max_retries_per_state": 2,
    "no_progress_threshold": 2
  },
  "retry_policy": {
    "transient_infra": {
      "retry": true,
      "max": 2,
      "backoff_ms": 1500,
      "escalate": "ESCALATED"
    },
    "agent_api_failure": {
      "retry": true,
      "max": 2,
      "backoff_ms": 2000,
      "escalate": "BLOCKED"
    },
    "deterministic_test": {
      "retry": false,
      "escalate": "IMPLEMENTATION",
      "via": "senior-implementer"
    },
    "implementation_defect": {
      "retry": false,
      "escalate": "IMPLEMENTATION",
      "via": "senior-implementer"
    },
    "specification_defect": {
      "retry": false,
      "escalate": "HUMAN"
    },
    "environmental_mismatch": {
      "retry": false,
      "escalate": "BLOCKED"
    },
    "permission_failure": {
      "retry": false,
      "escalate": "HUMAN"
    },
    "security_violation": {
      "retry": false,
      "escalate": "HUMAN"
    },
    "architectural_conflict": {
      "retry": false,
      "escalate": "HUMAN"
    },
    "unrecoverable_repo": {
      "retry": false,
      "escalate": "FAILED"
    }
  },
  "states": [
    {
      "id": "INTAKE",
      "purpose": "Receive the objective; confirm it is bounded and actionable.",
      "agent": "requirements-analyst",
      "read_only": true,
      "worktree": false,
      "risk": "none",
      "inputs": [
        "objective_text"
      ],
      "outputs": [
        "intake_record"
      ],
      "entry_conditions": [
        "objective_text_nonempty"
      ],
      "exit_conditions": [
        "objective_recorded",
        "run_id_assigned",
        "head_revision_recorded"
      ],
      "deterministic_commands": [],
      "review": {
        "required": false
      },
      "allowed_next": [
        "DISCOVERY"
      ],
      "retry_limit": 0,
      "timeout_ms": 120000,
      "on_failure": "BLOCKED",
      "on_escalation": "ESCALATED",
      "evidence_required": [
        "run_manifest",
        "head_sha"
      ]
    },
    {
      "id": "DISCOVERY",
      "purpose": "Establish verified facts about the repo relevant to the objective.",
      "agent": "architecture-planner",
      "read_only": true,
      "worktree": false,
      "risk": "none",
      "inputs": [
        "intake_record"
      ],
      "outputs": [
        "discovery_report"
      ],
      "entry_conditions": [
        "INTAKE_passed"
      ],
      "exit_conditions": [
        "discovery_report_validated",
        "facts_marked_verified_or_inferred"
      ],
      "deterministic_commands": [],
      "review": {
        "required": false
      },
      "allowed_next": [
        "REQUIREMENTS_SPEC"
      ],
      "retry_limit": 1,
      "timeout_ms": 300000,
      "on_failure": "BLOCKED",
      "on_escalation": "ESCALATED",
      "evidence_required": [
        "discovery_report"
      ]
    },
    {
      "id": "REQUIREMENTS_SPEC",
      "purpose": "Produce a measurable requirements record (objective, scope, acceptance, constraints, failure behavior, security/privacy).",
      "agent": "requirements-analyst",
      "read_only": true,
      "worktree": false,
      "risk": "none",
      "inputs": [
        "discovery_report"
      ],
      "outputs": [
        "requirements_doc"
      ],
      "entry_conditions": [
        "DISCOVERY_passed"
      ],
      "exit_conditions": [
        "requirements_gate_satisfied"
      ],
      "deterministic_commands": [],
      "review": {
        "required": true,
        "quorum": 2,
        "agent": "story-reviewer"
      },
      "allowed_next": [
        "STORY_DEFINITION"
      ],
      "retry_limit": 1,
      "timeout_ms": 300000,
      "on_failure": "BLOCKED",
      "on_escalation": "ESCALATED",
      "evidence_required": [
        "requirements_doc"
      ]
    },
    {
      "id": "STORY_DEFINITION",
      "purpose": "Decompose into independently reviewable, bounded stories with observable outcomes.",
      "agent": "requirements-analyst",
      "read_only": true,
      "worktree": false,
      "risk": "none",
      "inputs": [
        "requirements_doc"
      ],
      "outputs": [
        "stories"
      ],
      "entry_conditions": [
        "REQUIREMENTS_SPEC_passed"
      ],
      "exit_conditions": [
        "story_gate_satisfied"
      ],
      "deterministic_commands": [],
      "review": {
        "required": true,
        "quorum": 2,
        "agent": "story-reviewer"
      },
      "allowed_next": [
        "STORY_REVIEW",
        "TEST_DESIGN",
        "ARCHITECTURE_PRECHECK"
      ],
      "retry_limit": 1,
      "timeout_ms": 300000,
      "on_failure": "BLOCKED",
      "on_escalation": "ESCALATED",
      "evidence_required": [
        "stories"
      ]
    },
    {
      "id": "STORY_REVIEW",
      "purpose": "Independently review stories for measurability and traceability.",
      "agent": "story-reviewer",
      "read_only": true,
      "worktree": false,
      "risk": "none",
      "inputs": [
        "stories",
        "requirements_doc"
      ],
      "outputs": [
        "review_decision"
      ],
      "entry_conditions": [
        "STORY_DEFINITION_passed"
      ],
      "exit_conditions": [
        "review_quorum_met",
        "no_blocking_findings"
      ],
      "deterministic_commands": [],
      "review": {
        "required": false
      },
      "allowed_next": [
        "IMPLEMENTATION_PLAN"
      ],
      "retry_limit": 1,
      "timeout_ms": 300000,
      "on_failure": "STORY_DEFINITION",
      "on_escalation": "ESCALATED",
      "evidence_required": [
        "review_decision"
      ]
    },
    {
      "id": "TEST_DESIGN",
      "purpose": "Author Gherkin + QA matrix (happy, validation, authz, boundary, idempotency, concurrency, recovery, observability, regression).",
      "agent": "gherkin-author",
      "read_only": true,
      "worktree": false,
      "risk": "none",
      "inputs": [
        "stories"
      ],
      "outputs": [
        "gherkin_scenarios",
        "qa_matrix"
      ],
      "entry_conditions": [
        "STORY_DEFINITION_passed"
      ],
      "exit_conditions": [
        "qa_gate_satisfied"
      ],
      "deterministic_commands": [],
      "review": {
        "required": true,
        "quorum": 2,
        "agent": "qa-designer"
      },
      "allowed_next": [
        "IMPLEMENTATION_PLAN"
      ],
      "retry_limit": 1,
      "timeout_ms": 300000,
      "on_failure": "BLOCKED",
      "on_escalation": "ESCALATED",
      "evidence_required": [
        "gherkin_scenarios",
        "qa_matrix"
      ]
    },
    {
      "id": "ARCHITECTURE_PRECHECK",
      "purpose": "Define affected components, data-flow, compatibility, scaling, threat boundaries, migration/rollback.",
      "agent": "architecture-planner",
      "read_only": true,
      "worktree": false,
      "risk": "none",
      "inputs": [
        "stories",
        "discovery_report"
      ],
      "outputs": [
        "architecture_precheck"
      ],
      "entry_conditions": [
        "STORY_DEFINITION_passed"
      ],
      "exit_conditions": [
        "architecture_precheck_gate_satisfied"
      ],
      "deterministic_commands": [],
      "review": {
        "required": true,
        "quorum": 2,
        "agent": "architecture-reviewer"
      },
      "allowed_next": [
        "IMPLEMENTATION_PLAN"
      ],
      "retry_limit": 1,
      "timeout_ms": 300000,
      "on_failure": "BLOCKED",
      "on_escalation": "ESCALATED",
      "evidence_required": [
        "architecture_precheck"
      ]
    },
    {
      "id": "IMPLEMENTATION_PLAN",
      "purpose": "Synthesize reviewed stories, tests, and architecture into an owned, sequenced implementation plan.",
      "agent": "architecture-planner",
      "read_only": true,
      "worktree": false,
      "risk": "low",
      "inputs": [
        "stories",
        "gherkin_scenarios",
        "qa_matrix",
        "architecture_precheck",
        "review_decisions"
      ],
      "outputs": [
        "implementation_plan"
      ],
      "entry_conditions": [
        "STORY_REVIEW_passed",
        "TEST_DESIGN_passed",
        "ARCHITECTURE_PRECHECK_passed"
      ],
      "exit_conditions": [
        "implementation_gate_satisfied",
        "file_ownership_resolved"
      ],
      "deterministic_commands": [],
      "review": {
        "required": true,
        "quorum": 2,
        "agent": "architecture-reviewer"
      },
      "allowed_next": [
        "IMPLEMENTATION"
      ],
      "retry_limit": 1,
      "timeout_ms": 300000,
      "on_failure": "BLOCKED",
      "on_escalation": "ESCALATED",
      "evidence_required": [
        "implementation_plan",
        "ownership_map"
      ]
    },
    {
      "id": "IMPLEMENTATION",
      "purpose": "Implement owned units. Edits allowed only within the ownership map.",
      "agent": "implementer",
      "read_only": false,
      "worktree": true,
      "risk": "medium",
      "inputs": [
        "implementation_plan",
        "ownership_map",
        "gherkin_scenarios"
      ],
      "outputs": [
        "code_changes"
      ],
      "entry_conditions": [
        "IMPLEMENTATION_PLAN_passed",
        "repository_at_expected_revision",
        "no_blocking_questions"
      ],
      "exit_conditions": [
        "all_units_implemented",
        "no_overlap_violations"
      ],
      "deterministic_commands": [],
      "review": {
        "required": false
      },
      "allowed_next": [
        "UNIT_VERIFICATION"
      ],
      "retry_limit": 2,
      "timeout_ms": 1800000,
      "on_failure": "IMPLEMENTATION",
      "on_escalation": "IMPLEMENTATION",
      "evidence_required": [
        "diff",
        "files_touched",
        "ownership_acknowledgement"
      ]
    },
    {
      "id": "UNIT_VERIFICATION",